date,type,location,description,latitude,longitude
2023-01-15,Sexual assault,Kalamazoo College,Incident reported near dormitory,42.2900,-85.6041
2023-02-03,Sexual harassment,Downtown Kalamazoo,Street harassment incident,42.2922,-85.5872
2023-02-20,Attempted sexual assault,Western Michigan University,Attempted assault in parking lot,42.2829,-85.6159
2023-03-05,Sexual assault,Milwood Neighborhood,Assault in residential area,42.2706,-85.5728
2023-03-18,Sexual harassment,Vine Neighborhood,Harassment at local business,42.2845,-85.5941